{
  "uets_version": "1.0.0",
  "model": {
    "name": "llama3.2-3b-ollama",
    "endpoint": "http://localhost:11434/api/generate",
    "model_id": "llama3.2:latest",
    "type": "ollama"
  },
  "metadata": {
    "author": "reh3376",
    "created": "2026-02-24",
    "description": "Llama 3.2 3B via Ollama \u2014 baseline (used in Phase 103 E2E)",
    "parameters": "3B",
    "quantization": "Q4_K_M",
    "tags": [
      "ollama",
      "local",
      "baseline"
    ]
  },
  "config": {
    "temperature": 0.3,
    "max_tokens": 500,
    "timeout_ms": 10000,
    "retries": 1
  },
  "fixture": {
    "type": "file",
    "path": "../fixtures/clusters.json",
    "sha256": "25b59bdbfe4ed6d9d1951bf3d537d16567a663b357f461200cd5129d7172ed58"
  },
  "expected": {
    "thresholds": {
      "json_valid_rate": 0.6,
      "label_valid_rate": 0.5,
      "name_quality_rate": 0.4,
      "max_avg_latency_ms": 2000
    }
  },
  "patterns_covered": [
    "E1_JSON_CONFORMANCE",
    "E2_LABEL_CONSTRAINT",
    "E3_NAME_QUALITY",
    "E5_LATENCY"
  ]
}
